"No.","Time","Source","Destination","Protocol","Length","ID","Info"
"1","01:50:19.077016312","fe80::fa5e:42ff:feb9:eefa","ff02::1","ICMPv6","174","","Router Advertisement from f8:5e:42:b9:ee:fa"
"2","01:50:19.086478346","fe80::f2cd:7016:d1f2:6f85","ff02::16","ICMPv6","170","","Multicast Listener Report Message v2"
"3","01:50:20.090438468","fe80::f2cd:7016:d1f2:6f85","ff02::16","ICMPv6","170","","Multicast Listener Report Message v2"
"4","01:50:21.433218619","10.0.0.247","255.255.255.255","UDP","214","","49154  >  6666 Len=172"
"5","01:50:21.638497144","162.159.134.234","10.0.0.214","TLSv1.2","609","","Application Data"
"6","01:50:21.638532936","10.0.0.214","162.159.134.234","TCP","54","","42220  >  443 [ACK] Seq=1 Ack=556 Win=1961 Len=0"
"7","01:50:21.638497401","162.159.134.234","10.0.0.214","TLSv1.2","206","","Application Data"
"8","01:50:21.638549101","10.0.0.214","162.159.134.234","TCP","54","","42220  >  443 [ACK] Seq=1 Ack=708 Win=1961 Len=0"
"9","01:50:21.638497426","162.159.134.234","10.0.0.214","TLSv1.2","137","","Application Data"
"10","01:50:21.638553436","10.0.0.214","162.159.134.234","TCP","54","","42220  >  443 [ACK] Seq=1 Ack=791 Win=1961 Len=0"
"11","01:50:21.638497451","162.159.134.234","10.0.0.214","TLSv1.2","171","","Application Data"
"12","01:50:21.638570301","10.0.0.214","162.159.134.234","TCP","54","","42220  >  443 [ACK] Seq=1 Ack=908 Win=1961 Len=0"
"13","01:50:21.661423720","162.159.134.234","10.0.0.214","TLSv1.2","182","","Application Data"
"14","01:50:21.661456814","10.0.0.214","162.159.134.234","TCP","54","","42220  >  443 [ACK] Seq=1 Ack=1036 Win=1961 Len=0"
"15","01:50:21.671895204","162.159.134.234","10.0.0.214","TLSv1.2","162","","Application Data"
"16","01:50:21.671941782","10.0.0.214","162.159.134.234","TCP","54","","42220  >  443 [ACK] Seq=1 Ack=1144 Win=1961 Len=0"
"17","01:50:21.683557080","162.159.134.234","10.0.0.214","TLSv1.2","202","","Application Data"
"18","01:50:21.683589733","10.0.0.214","162.159.134.234","TCP","54","","42220  >  443 [ACK] Seq=1 Ack=1292 Win=1961 Len=0"
"19","01:50:21.705736359","162.159.134.234","10.0.0.214","TLSv1.2","162","","Application Data"
"20","01:50:21.705862017","10.0.0.214","162.159.134.234","TCP","54","","42220  >  443 [ACK] Seq=1 Ack=1400 Win=1961 Len=0"
"21","01:50:21.724164333","162.159.134.234","10.0.0.214","TLSv1.2","299","","Application Data"
"22","01:50:21.724195273","10.0.0.214","162.159.134.234","TCP","54","","42220  >  443 [ACK] Seq=1 Ack=1645 Win=1961 Len=0"
"23","01:50:21.739900791","162.159.134.234","10.0.0.214","TLSv1.2","152","","Application Data"
"24","01:50:21.739929408","10.0.0.214","162.159.134.234","TCP","54","","42220  >  443 [ACK] Seq=1 Ack=1743 Win=1961 Len=0"
"25","01:50:21.745439286","162.159.134.234","10.0.0.214","TLSv1.2","122","","Application Data"
"26","01:50:21.745476366","10.0.0.214","162.159.134.234","TCP","54","","42220  >  443 [ACK] Seq=1 Ack=1811 Win=1961 Len=0"
"27","01:50:21.755585807","162.159.134.234","10.0.0.214","TLSv1.2","120","","Application Data"
"28","01:50:21.755687925","10.0.0.214","162.159.134.234","TCP","54","","42220  >  443 [ACK] Seq=1 Ack=1877 Win=1961 Len=0"
"29","01:50:21.776692074","162.159.134.234","10.0.0.214","TLSv1.2","132","","Application Data"
"30","01:50:21.776722546","10.0.0.214","162.159.134.234","TCP","54","","42220  >  443 [ACK] Seq=1 Ack=1955 Win=1961 Len=0"
"31","01:50:21.790665592","162.159.134.234","10.0.0.214","TLSv1.2","125","","Application Data"
"32","01:50:21.790696252","10.0.0.214","162.159.134.234","TCP","54","","42220  >  443 [ACK] Seq=1 Ack=2026 Win=1961 Len=0"
"33","01:50:21.804439576","162.159.134.234","10.0.0.214","TLSv1.2","172","","Application Data"
"34","01:50:21.804469844","10.0.0.214","162.159.134.234","TCP","54","","42220  >  443 [ACK] Seq=1 Ack=2144 Win=1961 Len=0"
"35","01:50:21.839044487","162.159.134.234","10.0.0.214","TLSv1.2","256","","Application Data"
"36","01:50:21.839081284","10.0.0.214","162.159.134.234","TCP","54","","42220  >  443 [ACK] Seq=1 Ack=2346 Win=1961 Len=0"
"37","01:50:21.843190110","162.159.134.234","10.0.0.214","TLSv1.2","135","","Application Data"
"38","01:50:21.843221525","10.0.0.214","162.159.134.234","TCP","54","","42220  >  443 [ACK] Seq=1 Ack=2427 Win=1961 Len=0"
"39","01:50:21.865944031","162.159.134.234","10.0.0.214","TLSv1.2","118","","Application Data"
"40","01:50:21.866101226","10.0.0.214","162.159.134.234","TCP","54","","42220  >  443 [ACK] Seq=1 Ack=2491 Win=1961 Len=0"
"41","01:50:21.872926424","162.159.134.234","10.0.0.214","TLSv1.2","120","","Application Data"
"42","01:50:21.873077751","10.0.0.214","162.159.134.234","TCP","54","","42220  >  443 [ACK] Seq=1 Ack=2557 Win=1961 Len=0"
"43","01:50:21.876895412","162.159.134.234","10.0.0.214","TLSv1.2","163","","Application Data"
"44","01:50:21.877048964","10.0.0.214","162.159.134.234","TCP","54","","42220  >  443 [ACK] Seq=1 Ack=2666 Win=1961 Len=0"
"45","01:50:21.889970993","162.159.134.234","10.0.0.214","TLSv1.2","137","","Application Data"
"46","01:50:21.890058993","10.0.0.214","162.159.134.234","TCP","54","","42220  >  443 [ACK] Seq=1 Ack=2749 Win=1961 Len=0"
"47","01:50:21.909991486","162.159.134.234","10.0.0.214","TLSv1.2","146","","Application Data"
"48","01:50:21.910142147","10.0.0.214","162.159.134.234","TCP","54","","42220  >  443 [ACK] Seq=1 Ack=2841 Win=1961 Len=0"
"49","01:50:21.913684369","162.159.134.234","10.0.0.214","TLSv1.2","128","","Application Data"
"50","01:50:21.913833001","10.0.0.214","162.159.134.234","TCP","54","","42220  >  443 [ACK] Seq=1 Ack=2915 Win=1961 Len=0"
"51","01:50:21.925403243","162.159.134.234","10.0.0.214","TLSv1.2","125","","Application Data"
"52","01:50:21.925573229","10.0.0.214","162.159.134.234","TCP","54","","42220  >  443 [ACK] Seq=1 Ack=2986 Win=1961 Len=0"
"53","01:50:21.946798663","162.159.134.234","10.0.0.214","TLSv1.2","146","","Application Data"
"54","01:50:21.946947187","10.0.0.214","162.159.134.234","TCP","54","","42220  >  443 [ACK] Seq=1 Ack=3078 Win=1961 Len=0"
"55","01:50:21.954950820","162.159.134.234","10.0.0.214","TLSv1.2","128","","Application Data"
"56","01:50:21.955026146","10.0.0.214","162.159.134.234","TCP","54","","42220  >  443 [ACK] Seq=1 Ack=3152 Win=1961 Len=0"
"57","01:50:21.967876773","162.159.134.234","10.0.0.214","TLSv1.2","190","","Application Data"
"58","01:50:21.967953937","10.0.0.214","162.159.134.234","TCP","54","","42220  >  443 [ACK] Seq=1 Ack=3288 Win=1961 Len=0"
"59","01:50:21.997776778","162.159.134.234","10.0.0.214","TLSv1.2","146","","Application Data"
"60","01:50:21.997878050","10.0.0.214","162.159.134.234","TCP","54","","42220  >  443 [ACK] Seq=1 Ack=3380 Win=1961 Len=0"
"61","01:50:22.006990603","162.159.134.234","10.0.0.214","TLSv1.2","192","","Application Data"
"62","01:50:22.007078248","10.0.0.214","162.159.134.234","TCP","54","","42220  >  443 [ACK] Seq=1 Ack=3518 Win=1961 Len=0"
"63","01:50:22.025073069","162.159.134.234","10.0.0.214","TLSv1.2","135","","Application Data"
"64","01:50:22.025154328","10.0.0.214","162.159.134.234","TCP","54","","42220  >  443 [ACK] Seq=1 Ack=3599 Win=1961 Len=0"
"65","01:50:22.054208996","fe80::fa5e:42ff:feb9:eefa","ff02::1","ICMPv6","174","","Router Advertisement from f8:5e:42:b9:ee:fa"
"66","01:50:22.054210796","162.159.134.234","10.0.0.214","TLSv1.2","224","","Application Data"
"67","01:50:22.054306002","10.0.0.214","162.159.134.234","TCP","54","","42220  >  443 [ACK] Seq=1 Ack=3769 Win=1961 Len=0"
"68","01:50:22.057577941","162.159.134.234","10.0.0.214","TLSv1.2","209","","Application Data"
"69","01:50:22.057665267","10.0.0.214","162.159.134.234","TCP","54","","42220  >  443 [ACK] Seq=1 Ack=3924 Win=1961 Len=0"
"70","01:50:22.065052694","162.159.134.234","10.0.0.214","TLSv1.2","146","","Application Data"
"71","01:50:22.065136465","10.0.0.214","162.159.134.234","TCP","54","","42220  >  443 [ACK] Seq=1 Ack=4016 Win=1961 Len=0"
"72","01:50:22.066421847","fe80::f2cd:7016:d1f2:6f85","ff02::16","ICMPv6","170","","Multicast Listener Report Message v2"
"73","01:50:22.078871061","162.159.134.234","10.0.0.214","TLSv1.2","125","","Application Data"
"74","01:50:22.078955524","10.0.0.214","162.159.134.234","TCP","54","","42220  >  443 [ACK] Seq=1 Ack=4087 Win=1961 Len=0"
"75","01:50:22.091990034","162.159.134.234","10.0.0.214","TLSv1.2","132","","Application Data"
"76","01:50:22.092098221","10.0.0.214","162.159.134.234","TCP","54","","42220  >  443 [ACK] Seq=1 Ack=4165 Win=1961 Len=0"
"77","01:50:22.114387393","162.159.134.234","10.0.0.214","TLSv1.2","156","","Application Data"
"78","01:50:22.114460458","10.0.0.214","162.159.134.234","TCP","54","","42220  >  443 [ACK] Seq=1 Ack=4267 Win=1961 Len=0"
"79","01:50:22.121991820","162.159.134.234","10.0.0.214","TLSv1.2","130","","Application Data"
"80","01:50:22.122144690","10.0.0.214","162.159.134.234","TCP","54","","42220  >  443 [ACK] Seq=1 Ack=4343 Win=1961 Len=0"
"81","01:50:22.136371766","162.159.134.234","10.0.0.214","TLSv1.2","132","","Application Data"
"82","01:50:22.136536697","10.0.0.214","162.159.134.234","TCP","54","","42220  >  443 [ACK] Seq=1 Ack=4421 Win=1961 Len=0"
"83","01:50:22.149333882","162.159.134.234","10.0.0.214","TLSv1.2","140","","Application Data"
"84","01:50:22.149496191","10.0.0.214","162.159.134.234","TCP","54","","42220  >  443 [ACK] Seq=1 Ack=4507 Win=1961 Len=0"
"85","01:50:22.230456516","fe80::f2cd:7016:d1f2:6f85","ff02::16","ICMPv6","170","","Multicast Listener Report Message v2"
"86","01:50:22.450189542","10.0.0.214","10.0.0.69","TCP","183","","52290  >  8009 [PSH, ACK] Seq=1 Ack=1 Win=501 Len=117 TSval=452420332 TSecr=449191 [TCP segment of a reassembled PDU]"
"87","01:50:22.474563446","10.0.0.69","10.0.0.214","TCP","183","","8009  >  52290 [PSH, ACK] Seq=1 Ack=118 Win=277 Len=117 TSval=449694 TSecr=452420332 [TCP segment of a reassembled PDU]"
"88","01:50:22.474606092","10.0.0.214","10.0.0.69","TCP","66","","52290  >  8009 [ACK] Seq=118 Ack=118 Win=501 Len=0 TSval=452420356 TSecr=449694"
"89","01:50:24.504179667","10.0.0.247","255.255.255.255","UDP","214","","49154  >  6666 Len=172"
"90","01:50:24.843753714","10.0.0.214","8.8.8.8","DNS","85","","Standard query 0x09ba A www.google.com OPT"
"91","01:50:24.843812075","10.0.0.214","8.8.8.8","DNS","81","","Standard query 0xcaa7 A google.com OPT"
"92","01:50:24.843897484","10.0.0.214","8.8.8.8","DNS","94","","Standard query 0xedd9 A youtubei.googleapis.com OPT"
"93","01:50:24.843962593","10.0.0.214","8.8.8.8","DNS","94","","Standard query 0x00cf A youtube-ui.l.google.com OPT"
"94","01:50:24.844039205","10.0.0.214","8.8.8.8","DNS","84","","Standard query 0x9cab A m.youtube.com OPT"
"95","01:50:24.844073398","10.0.0.214","8.8.8.8","DNS","93","","Standard query 0x9357 A youtube.googleapis.com OPT"
"96","01:50:24.844105684","10.0.0.214","8.8.8.8","DNS","91","","Standard query 0x0e66 A restrict.youtube.com OPT"
"97","01:50:24.865132095","8.8.8.8","10.0.0.214","DNS","181","","Standard query response 0x09ba A www.google.com A 142.250.31.106 A 142.250.31.103 A 142.250.31.99 A 142.250.31.147 A 142.250.31.105 A 142.250.31.104 OPT"
"98","01:50:24.865743504","10.0.0.214","8.8.8.8","DNS","93","","Standard query 0x56d1 A sitereview.zscaler.com OPT"
"99","01:50:24.870961925","8.8.8.8","10.0.0.214","DNS","110","","Standard query response 0xedd9 A youtubei.googleapis.com A 142.250.65.74 OPT"
"100","01:50:24.870961913","8.8.8.8","10.0.0.214","DNS","100","","Standard query response 0x9cab A m.youtube.com A 142.251.33.206 OPT"
"101","01:50:24.870964126","8.8.8.8","10.0.0.214","DNS","109","","Standard query response 0x9357 A youtube.googleapis.com A 142.250.65.74 OPT"
"102","01:50:24.870961639","8.8.8.8","10.0.0.214","DNS","97","","Standard query response 0xcaa7 A google.com A 142.251.33.206 OPT"
"103","01:50:24.870961792","8.8.8.8","10.0.0.214","DNS","107","","Standard query response 0x0e66 A restrict.youtube.com A 216.239.38.120 OPT"
"104","01:50:24.870964158","8.8.8.8","10.0.0.214","DNS","254","","Standard query response 0x00cf A youtube-ui.l.google.com A 172.217.13.78 A 172.217.13.238 A 172.217.15.78 A 142.250.81.206 A 142.251.33.206 A 172.217.164.174 A 172.217.12.238 A 142.250.73.206 A 142.250.65.78 A 172.217.8.14 OPT"
"105","01:50:24.871484679","10.0.0.214","8.8.8.8","DNS","94","","Standard query 0x2715 A use-application-dns.net OPT"
"106","01:50:24.871541123","10.0.0.214","8.8.8.8","DNS","95","","Standard query 0xd0d8 A detectportal.firefox.com OPT"
"107","01:50:24.871595853","10.0.0.214","8.8.8.8","DNS","95","","Standard query 0x699f AAAA detectportal.firefox.com OPT"
"108","01:50:24.885048575","8.8.8.8","10.0.0.214","DNS","109","","Standard query response 0x56d1 A sitereview.zscaler.com A 199.168.148.86 OPT"
"109","01:50:24.891477157","8.8.8.8","10.0.0.214","DNS","142","","Standard query response 0x2715 A use-application-dns.net A 44.236.48.31 A 44.236.72.93 A 44.235.246.155 OPT"
"110","01:50:24.891840054","8.8.8.8","10.0.0.214","DNS","206","","Standard query response 0xd0d8 A detectportal.firefox.com CNAME detectportal.prod.mozaws.net CNAME prod.detectportal.prod.cloudops.mozgcp.net A 34.107.221.82 OPT"
"111","01:50:24.897793205","8.8.8.8","10.0.0.214","DNS","218","","Standard query response 0x699f AAAA detectportal.firefox.com CNAME detectportal.prod.mozaws.net CNAME prod.detectportal.prod.cloudops.mozgcp.net AAAA 2600:1901:0:38d7:: OPT"
"112","01:50:24.898102169","2601:143:c701:ae60:6758:2126:81b1:b731","2600:1901:0:38d7::","TCP","94","","46298  >  80 [SYN] Seq=0 Win=64800 Len=0 MSS=1440 SACK_PERM=1 TSval=2465725882 TSecr=0 WS=128"
"113","01:50:24.921645431","2600:1901:0:38d7::","2601:143:c701:ae60:6758:2126:81b1:b731","TCP","94","","80  >  46298 [SYN, ACK] Seq=0 Ack=1 Win=65535 Len=0 MSS=1440 SACK_PERM=1 TSval=1739789707 TSecr=2465725882 WS=256"
"114","01:50:24.921689434","2601:143:c701:ae60:6758:2126:81b1:b731","2600:1901:0:38d7::","TCP","86","","46298  >  80 [ACK] Seq=1 Ack=1 Win=64896 Len=0 TSval=2465725906 TSecr=1739789707"
"115","01:50:24.921864176","2601:143:c701:ae60:6758:2126:81b1:b731","2600:1901:0:38d7::","HTTP","382","","GET /success.txt HTTP/1.1 "
"116","01:50:24.951359134","2600:1901:0:38d7::","2601:143:c701:ae60:6758:2126:81b1:b731","TCP","86","","80  >  46298 [ACK] Seq=1 Ack=297 Win=66816 Len=0 TSval=1739789734 TSecr=2465725906"
"117","01:50:24.952221991","2600:1901:0:38d7::","2601:143:c701:ae60:6758:2126:81b1:b731","HTTP","306","","HTTP/1.1 200 OK  (text/plain)"
"118","01:50:24.952235624","2601:143:c701:ae60:6758:2126:81b1:b731","2600:1901:0:38d7::","TCP","86","","46298  >  80 [ACK] Seq=297 Ack=221 Win=64768 Len=0 TSval=2465725937 TSecr=1739789735"
"119","01:50:25.015776714","10.0.0.214","8.8.8.8","DNS","79","","Standard query 0xdfc4 A doh.test OPT"
"120","01:50:25.021610860","10.0.0.214","8.8.8.8","DNS","84","","Standard query 0xf931 AAAA ipv4only.arpa OPT"
"121","01:50:25.021850034","10.0.0.214","34.107.221.82","TCP","74","","55892  >  80 [SYN] Seq=0 Win=64240 Len=0 MSS=1460 SACK_PERM=1 TSval=2688939687 TSecr=0 WS=128"
"122","01:50:25.022124117","2601:143:c701:ae60:6758:2126:81b1:b731","2600:1901:0:38d7::","TCP","94","","46302  >  80 [SYN] Seq=0 Win=64800 Len=0 MSS=1440 SACK_PERM=1 TSval=2465726006 TSecr=0 WS=128"
"123","01:50:25.033971235","8.8.8.8","10.0.0.214","DNS","154","","Standard query response 0xdfc4 No such name A doh.test SOA a.root-servers.net OPT"
"124","01:50:25.034071010","10.0.0.214","8.8.8.8","DNS","97","","Standard query 0xa99f A mozilla.cloudflare-dns.com OPT"
"125","01:50:25.034130953","10.0.0.214","8.8.8.8","DNS","97","","Standard query 0xe1cb AAAA mozilla.cloudflare-dns.com OPT"
"126","01:50:25.034151000","10.0.0.214","8.8.8.8","DNS","68","","Standard query 0xdfc4 A doh.test"
"127","01:50:25.038505509","8.8.8.8","10.0.0.214","DNS","141","","Standard query response 0xf931 AAAA ipv4only.arpa SOA sns.dns.icann.org OPT"
"128","01:50:25.043516623","2600:1901:0:38d7::","2601:143:c701:ae60:6758:2126:81b1:b731","TCP","94","","80  >  46302 [SYN, ACK] Seq=0 Ack=1 Win=65535 Len=0 MSS=1440 SACK_PERM=1 TSval=3598902775 TSecr=2465726006 WS=256"
"129","01:50:25.043543110","2601:143:c701:ae60:6758:2126:81b1:b731","2600:1901:0:38d7::","TCP","86","","46302  >  80 [ACK] Seq=1 Ack=1 Win=64896 Len=0 TSval=2465726028 TSecr=3598902775"
"130","01:50:25.043567234","34.107.221.82","10.0.0.214","TCP","74","","80  >  55892 [SYN, ACK] Seq=0 Ack=1 Win=65535 Len=0 MSS=1430 SACK_PERM=1 TSval=1102050553 TSecr=2688939687 WS=256"
"131","01:50:25.043586497","10.0.0.214","34.107.221.82","TCP","66","","55892  >  80 [ACK] Seq=1 Ack=1 Win=64256 Len=0 TSval=2688939709 TSecr=1102050553"
"132","01:50:25.043609280","2601:143:c701:ae60:6758:2126:81b1:b731","2600:1901:0:38d7::","HTTP","387","","GET /success.txt?ipv6 HTTP/1.1 "
"133","01:50:25.043660871","10.0.0.214","34.107.221.82","HTTP","367","","GET /success.txt?ipv4 HTTP/1.1 "
"134","01:50:25.051528001","10.0.0.214","162.159.134.234","TLSv1.2","108","","Application Data"
"135","01:50:25.079828966","8.8.8.8","10.0.0.214","DNS","143","","Standard query response 0xdfc4 No such name A doh.test SOA a.root-servers.net"
"136","01:50:25.079933830","8.8.8.8","10.0.0.214","DNS","129","","Standard query response 0xa99f A mozilla.cloudflare-dns.com A 104.16.249.249 A 104.16.248.249 OPT"
"137","01:50:25.079933591","8.8.8.8","10.0.0.214","DNS","153","","Standard query response 0xe1cb AAAA mozilla.cloudflare-dns.com AAAA 2606:4700::6810:f9f9 AAAA 2606:4700::6810:f8f9 OPT"
"138","01:50:25.079963680","2600:1901:0:38d7::","2601:143:c701:ae60:6758:2126:81b1:b731","TCP","86","","80  >  46302 [ACK] Seq=1 Ack=302 Win=66816 Len=0 TSval=3598902811 TSecr=2465726028"
"139","01:50:25.080480385","2601:143:c701:ae60:6758:2126:81b1:b731","2606:4700::6810:f9f9","TCP","94","","47026  >  443 [SYN] Seq=0 Win=64800 Len=0 MSS=1440 SACK_PERM=1 TSval=4214025610 TSecr=0 WS=128"
"140","01:50:25.080521864","2601:143:c701:ae60:6758:2126:81b1:b731","2606:4700::6810:f9f9","TCP","94","","47028  >  443 [SYN] Seq=0 Win=64800 Len=0 MSS=1440 SACK_PERM=1 TSval=4214025610 TSecr=0 WS=128"
"141","01:50:25.080565985","2601:143:c701:ae60:6758:2126:81b1:b731","2606:4700::6810:f9f9","TCP","94","","47030  >  443 [SYN] Seq=0 Win=64800 Len=0 MSS=1440 SACK_PERM=1 TSval=4214025610 TSecr=0 WS=128"
"142","01:50:25.080600157","2601:143:c701:ae60:6758:2126:81b1:b731","2606:4700::6810:f9f9","TCP","94","","47032  >  443 [SYN] Seq=0 Win=64800 Len=0 MSS=1440 SACK_PERM=1 TSval=4214025610 TSecr=0 WS=128"
"143","01:50:25.080645929","2601:143:c701:ae60:6758:2126:81b1:b731","2606:4700::6810:f9f9","TCP","94","","47034  >  443 [SYN] Seq=0 Win=64800 Len=0 MSS=1440 SACK_PERM=1 TSval=4214025610 TSecr=0 WS=128"
"144","01:50:25.081428803","2600:1901:0:38d7::","2601:143:c701:ae60:6758:2126:81b1:b731","HTTP","306","","HTTP/1.1 200 OK  (text/plain)"
"145","01:50:25.081440144","2601:143:c701:ae60:6758:2126:81b1:b731","2600:1901:0:38d7::","TCP","86","","46302  >  80 [ACK] Seq=302 Ack=221 Win=64768 Len=0 TSval=2465726066 TSecr=3598902812"
"146","01:50:25.090438587","162.159.134.234","10.0.0.214","TLSv1.2","100","","Application Data"
"147","01:50:25.090567747","10.0.0.214","162.159.134.234","TCP","54","","42220  >  443 [ACK] Seq=55 Ack=4553 Win=1961 Len=0"
"148","01:50:25.096283053","34.107.221.82","10.0.0.214","TCP","66","","80  >  55892 [ACK] Seq=1 Ack=302 Win=66816 Len=0 TSval=1102050606 TSecr=2688939709"
"149","01:50:25.096356032","34.107.221.82","10.0.0.214","HTTP","286","","HTTP/1.1 200 OK  (text/plain)"
"150","01:50:25.096369224","10.0.0.214","34.107.221.82","TCP","66","","55892  >  80 [ACK] Seq=302 Ack=221 Win=64128 Len=0 TSval=2688939762 TSecr=1102050607"
"151","01:50:25.100412111","2606:4700::6810:f9f9","2601:143:c701:ae60:6758:2126:81b1:b731","TCP","86","","443  >  47026 [SYN, ACK] Seq=0 Ack=1 Win=65535 Len=0 MSS=1360 SACK_PERM=1 WS=1024"
"152","01:50:25.100443131","2601:143:c701:ae60:6758:2126:81b1:b731","2606:4700::6810:f9f9","TCP","74","","47026  >  443 [ACK] Seq=1 Ack=1 Win=64896 Len=0"
"153","01:50:25.103092329","2601:143:c701:ae60:6758:2126:81b1:b731","2606:4700::6810:f9f9","TLSv1.3","591","","Client Hello"
"154","01:50:25.105021130","2606:4700::6810:f9f9","2601:143:c701:ae60:6758:2126:81b1:b731","TCP","86","","443  >  47030 [SYN, ACK] Seq=0 Ack=1 Win=65535 Len=0 MSS=1360 SACK_PERM=1 WS=1024"
"155","01:50:25.105108995","2601:143:c701:ae60:6758:2126:81b1:b731","2606:4700::6810:f9f9","TCP","74","","47030  >  443 [ACK] Seq=1 Ack=1 Win=64896 Len=0"
"156","01:50:25.105113768","2606:4700::6810:f9f9","2601:143:c701:ae60:6758:2126:81b1:b731","TCP","86","","443  >  47028 [SYN, ACK] Seq=0 Ack=1 Win=65535 Len=0 MSS=1360 SACK_PERM=1 WS=1024"
"157","01:50:25.105138649","2601:143:c701:ae60:6758:2126:81b1:b731","2606:4700::6810:f9f9","TCP","74","","47028  >  443 [ACK] Seq=1 Ack=1 Win=64896 Len=0"
"158","01:50:25.106836541","2601:143:c701:ae60:6758:2126:81b1:b731","2606:4700::6810:f9f9","TLSv1.3","591","","Client Hello"
"159","01:50:25.108093653","2601:143:c701:ae60:6758:2126:81b1:b731","2606:4700::6810:f9f9","TLSv1.3","591","","Client Hello"
"160","01:50:25.111637225","2606:4700::6810:f9f9","2601:143:c701:ae60:6758:2126:81b1:b731","TCP","86","","443  >  47034 [SYN, ACK] Seq=0 Ack=1 Win=65535 Len=0 MSS=1360 SACK_PERM=1 WS=1024"
"161","01:50:25.111667759","2601:143:c701:ae60:6758:2126:81b1:b731","2606:4700::6810:f9f9","TCP","74","","47034  >  443 [ACK] Seq=1 Ack=1 Win=64896 Len=0"
"162","01:50:25.112937289","2606:4700::6810:f9f9","2601:143:c701:ae60:6758:2126:81b1:b731","TCP","86","","443  >  47032 [SYN, ACK] Seq=0 Ack=1 Win=65535 Len=0 MSS=1360 SACK_PERM=1 WS=1024"
"163","01:50:25.112962045","2601:143:c701:ae60:6758:2126:81b1:b731","2606:4700::6810:f9f9","TCP","74","","47032  >  443 [ACK] Seq=1 Ack=1 Win=64896 Len=0"
"164","01:50:25.113033057","2601:143:c701:ae60:6758:2126:81b1:b731","2606:4700::6810:f9f9","TLSv1.3","591","","Client Hello"
"165","01:50:25.114263668","2601:143:c701:ae60:6758:2126:81b1:b731","2606:4700::6810:f9f9","TLSv1.3","591","","Client Hello"
"166","01:50:25.123834417","fe80::fa5e:42ff:feb9:eefa","ff02::1","ICMPv6","174","","Router Advertisement from f8:5e:42:b9:ee:fa"
"167","01:50:25.123835637","2606:4700::6810:f9f9","2601:143:c701:ae60:6758:2126:81b1:b731","TCP","74","","443  >  47026 [ACK] Seq=1 Ack=518 Win=67584 Len=0"
"168","01:50:25.125610008","2606:4700::6810:f9f9","2601:143:c701:ae60:6758:2126:81b1:b731","TLSv1.3","1434","","Server Hello, Change Cipher Spec"
"169","01:50:25.125631224","2601:143:c701:ae60:6758:2126:81b1:b731","2606:4700::6810:f9f9","TCP","74","","47026  >  443 [ACK] Seq=518 Ack=1361 Win=63616 Len=0"
"170","01:50:25.126337754","2606:4700::6810:f9f9","2601:143:c701:ae60:6758:2126:81b1:b731","TCP","1434","","443  >  47026 [ACK] Seq=1361 Ack=518 Win=67584 Len=1360 [TCP segment of a reassembled PDU]"
"171","01:50:25.126382998","2601:143:c701:ae60:6758:2126:81b1:b731","2606:4700::6810:f9f9","TCP","74","","47026  >  443 [ACK] Seq=518 Ack=2721 Win=63104 Len=0"
"172","01:50:25.126456443","2606:4700::6810:f9f9","2601:143:c701:ae60:6758:2126:81b1:b731","TLSv1.3","496","","Application Data"
"173","01:50:25.126460445","2601:143:c701:ae60:6758:2126:81b1:b731","2606:4700::6810:f9f9","TCP","74","","47026  >  443 [ACK] Seq=518 Ack=3143 Win=63104 Len=0"
"174","01:50:25.130572935","2606:4700::6810:f9f9","2601:143:c701:ae60:6758:2126:81b1:b731","TCP","74","","443  >  47030 [ACK] Seq=1 Ack=518 Win=67584 Len=0"
"175","01:50:25.131005396","2606:4700::6810:f9f9","2601:143:c701:ae60:6758:2126:81b1:b731","TCP","74","","[TCP Dup ACK 174#1] 443  >  47030 [ACK] Seq=1 Ack=518 Win=67584 Len=0"
"176","01:50:25.131675447","2601:143:c701:ae60:6758:2126:81b1:b731","2606:4700::6810:f9f9","TLSv1.3","138","","Change Cipher Spec, Application Data"
"177","01:50:25.131713510","2606:4700::6810:f9f9","2601:143:c701:ae60:6758:2126:81b1:b731","TLSv1.3","1434","","Server Hello, Change Cipher Spec"
"178","01:50:25.131724855","2601:143:c701:ae60:6758:2126:81b1:b731","2606:4700::6810:f9f9","TCP","74","","47030  >  443 [ACK] Seq=518 Ack=1361 Win=63616 Len=0"
"179","01:50:25.132062733","2601:143:c701:ae60:6758:2126:81b1:b731","2606:4700::6810:f9f9","TLSv1.3","244","","Application Data"
"180","01:50:25.132102386","2601:143:c701:ae60:6758:2126:81b1:b731","2606:4700::6810:f9f9","TLSv1.3","304","","Application Data, Application Data"
"181","01:50:25.132676295","2606:4700::6810:f9f9","2601:143:c701:ae60:6758:2126:81b1:b731","TCP","1434","","443  >  47030 [ACK] Seq=1361 Ack=518 Win=67584 Len=1360 [TCP segment of a reassembled PDU]"
"182","01:50:25.132683888","2601:143:c701:ae60:6758:2126:81b1:b731","2606:4700::6810:f9f9","TCP","74","","47030  >  443 [ACK] Seq=518 Ack=2721 Win=63104 Len=0"
"183","01:50:25.134069130","2606:4700::6810:f9f9","2601:143:c701:ae60:6758:2126:81b1:b731","TLSv1.3","497","","Application Data"
"184","01:50:25.134074526","2601:143:c701:ae60:6758:2126:81b1:b731","2606:4700::6810:f9f9","TCP","74","","47030  >  443 [ACK] Seq=518 Ack=3144 Win=63104 Len=0"
"185","01:50:25.136983675","2606:4700::6810:f9f9","2601:143:c701:ae60:6758:2126:81b1:b731","TCP","74","","443  >  47034 [ACK] Seq=1 Ack=518 Win=67584 Len=0"
"186","01:50:25.137372479","2606:4700::6810:f9f9","2601:143:c701:ae60:6758:2126:81b1:b731","TCP","74","","443  >  47028 [ACK] Seq=1 Ack=518 Win=67584 Len=0"
"187","01:50:25.137720633","2606:4700::6810:f9f9","2601:143:c701:ae60:6758:2126:81b1:b731","TCP","74","","443  >  47032 [ACK] Seq=1 Ack=518 Win=67584 Len=0"
"188","01:50:25.138143785","2606:4700::6810:f9f9","2601:143:c701:ae60:6758:2126:81b1:b731","TLSv1.3","1434","","Server Hello, Change Cipher Spec"
"189","01:50:25.138196576","2601:143:c701:ae60:6758:2126:81b1:b731","2606:4700::6810:f9f9","TCP","74","","47034  >  443 [ACK] Seq=518 Ack=1361 Win=63616 Len=0"
"190","01:50:25.138260890","2606:4700::6810:f9f9","2601:143:c701:ae60:6758:2126:81b1:b731","TLSv1.3","1856","","Application Data"
"191","01:50:25.138271660","2601:143:c701:ae60:6758:2126:81b1:b731","2606:4700::6810:f9f9","TCP","74","","47034  >  443 [ACK] Seq=518 Ack=3143 Win=61952 Len=0"
"192","01:50:25.138334667","fe80::f2cd:7016:d1f2:6f85","ff02::16","ICMPv6","170","","Multicast Listener Report Message v2"
"193","01:50:25.138655927","2601:143:c701:ae60:6758:2126:81b1:b731","2606:4700::6810:f9f9","TLSv1.3","138","","Change Cipher Spec, Application Data"
"194","01:50:25.139562753","2606:4700::6810:f9f9","2601:143:c701:ae60:6758:2126:81b1:b731","TLSv1.3","3217","","Server Hello, Change Cipher Spec, Application Data"
"195","01:50:25.139563082","2606:4700::6810:f9f9","2601:143:c701:ae60:6758:2126:81b1:b731","TLSv1.3","3217","","Server Hello, Change Cipher Spec, Application Data"
"196","01:50:25.139571338","2601:143:c701:ae60:6758:2126:81b1:b731","2606:4700::6810:f9f9","TCP","74","","47028  >  443 [ACK] Seq=518 Ack=3144 Win=61824 Len=0"
"197","01:50:25.139575708","2601:143:c701:ae60:6758:2126:81b1:b731","2606:4700::6810:f9f9","TCP","74","","47032  >  443 [ACK] Seq=518 Ack=3144 Win=61824 Len=0"
"198","01:50:25.140681092","2601:143:c701:ae60:6758:2126:81b1:b731","2606:4700::6810:f9f9","TLSv1.3","261","","Application Data"
"199","01:50:25.140776510","2601:143:c701:ae60:6758:2126:81b1:b731","2606:4700::6810:f9f9","TLSv1.3","134","","Application Data"
"200","01:50:25.140786262","2601:143:c701:ae60:6758:2126:81b1:b731","2606:4700::6810:f9f9","TLSv1.3","172","","Application Data"
"201","01:50:25.146036681","2601:143:c701:ae60:6758:2126:81b1:b731","2606:4700::6810:f9f9","TLSv1.3","227","","Application Data, Application Data"
"202","01:50:25.146312359","2601:143:c701:ae60:6758:2126:81b1:b731","2606:4700::6810:f9f9","TLSv1.3","138","","Change Cipher Spec, Application Data"
"203","01:50:25.146467198","2601:143:c701:ae60:6758:2126:81b1:b731","2606:4700::6810:f9f9","TLSv1.3","261","","Application Data"
"204","01:50:25.146513720","2601:143:c701:ae60:6758:2126:81b1:b731","2606:4700::6810:f9f9","TLSv1.3","130","","Application Data"
"205","01:50:25.146521680","2601:143:c701:ae60:6758:2126:81b1:b731","2606:4700::6810:f9f9","TLSv1.3","167","","Application Data"
"206","01:50:25.146875266","2601:143:c701:ae60:6758:2126:81b1:b731","2606:4700::6810:f9f9","TLSv1.3","237","","Application Data, Application Data"
"207","01:50:25.147146441","2601:143:c701:ae60:6758:2126:81b1:b731","2606:4700::6810:f9f9","TLSv1.3","138","","Change Cipher Spec, Application Data"
"208","01:50:25.147329787","2601:143:c701:ae60:6758:2126:81b1:b731","2606:4700::6810:f9f9","TLSv1.3","261","","Application Data"
"209","01:50:25.147453328","2601:143:c701:ae60:6758:2126:81b1:b731","2606:4700::6810:f9f9","TLSv1.3","130","","Application Data"
"210","01:50:25.147991493","2601:143:c701:ae60:6758:2126:81b1:b731","2606:4700::6810:f9f9","TLSv1.3","138","","Change Cipher Spec, Application Data"
"211","01:50:25.148145697","2601:143:c701:ae60:6758:2126:81b1:b731","2606:4700::6810:f9f9","TLSv1.3","261","","Application Data"
"212","01:50:25.152793584","2606:4700::6810:f9f9","2601:143:c701:ae60:6758:2126:81b1:b731","TCP","74","","443  >  47026 [ACK] Seq=3143 Ack=582 Win=67584 Len=0"
"213","01:50:25.152841100","2601:143:c701:ae60:6758:2126:81b1:b731","2606:4700::6810:f9f9","TLSv1.3","331","","Application Data, Application Data, Application Data"
"214","01:50:25.152902803","2606:4700::6810:f9f9","2601:143:c701:ae60:6758:2126:81b1:b731","TCP","74","","443  >  47026 [ACK] Seq=3143 Ack=752 Win=68608 Len=0"
"215","01:50:25.153569570","2606:4700::6810:f9f9","2601:143:c701:ae60:6758:2126:81b1:b731","TLSv1.3","611","","Application Data, Application Data"
"216","01:50:25.153576132","2601:143:c701:ae60:6758:2126:81b1:b731","2606:4700::6810:f9f9","TCP","74","","47026  >  443 [ACK] Seq=1918 Ack=3680 Win=63616 Len=0"
"217","01:50:25.153713687","2601:143:c701:ae60:6758:2126:81b1:b731","2606:4700::6810:f9f9","TLSv1.3","105","","Application Data"
"218","01:50:25.158371769","2606:4700::6810:f9f9","2601:143:c701:ae60:6758:2126:81b1:b731","TCP","74","","443  >  47030 [ACK] Seq=3144 Ack=582 Win=67584 Len=0"
"219","01:50:25.158784386","2606:4700::6810:f9f9","2601:143:c701:ae60:6758:2126:81b1:b731","TLSv1.3","602","","Application Data, Application Data"
"220","01:50:25.158796254","2601:143:c701:ae60:6758:2126:81b1:b731","2606:4700::6810:f9f9","TCP","74","","47030  >  443 [ACK] Seq=769 Ack=3672 Win=63616 Len=0"
"221","01:50:25.158901041","2606:4700::6810:f9f9","2601:143:c701:ae60:6758:2126:81b1:b731","TCP","74","","443  >  47026 [ACK] Seq=3680 Ack=982 Win=69632 Len=0"
"222","01:50:25.158975532","2601:143:c701:ae60:6758:2126:81b1:b731","2606:4700::6810:f9f9","TLSv1.3","98","","Application Data"
"223","01:50:25.158986033","2601:143:c701:ae60:6758:2126:81b1:b731","2606:4700::6810:f9f9","TCP","74","","47030  >  443 [FIN, ACK] Seq=793 Ack=3672 Win=64128 Len=0"
"224","01:50:25.165554309","2606:4700::6810:f9f9","2601:143:c701:ae60:6758:2126:81b1:b731","TLSv1.3","408","","Application Data"
"225","01:50:25.165592749","2601:143:c701:ae60:6758:2126:81b1:b731","2606:4700::6810:f9f9","TCP","74","","47026  >  443 [ACK] Seq=1949 Ack=4014 Win=64128 Len=0"
"226","01:50:25.166454495","2606:4700::6810:f9f9","2601:143:c701:ae60:6758:2126:81b1:b731","TLSv1.3","105","","Application Data"
"227","01:50:25.166455391","2606:4700::6810:f9f9","2601:143:c701:ae60:6758:2126:81b1:b731","TCP","74","","443  >  47034 [ACK] Seq=3143 Ack=582 Win=67584 Len=0"
"228","01:50:25.166489840","2601:143:c701:ae60:6758:2126:81b1:b731","2606:4700::6810:f9f9","TCP","74","","47026  >  443 [ACK] Seq=1949 Ack=4045 Win=64128 Len=0"
"229","01:50:25.166522442","2606:4700::6810:f9f9","2601:143:c701:ae60:6758:2126:81b1:b731","TCP","74","","443  >  47034 [ACK] Seq=3143 Ack=769 Win=68608 Len=0"
"230","01:50:25.166528874","2606:4700::6810:f9f9","2601:143:c701:ae60:6758:2126:81b1:b731","TCP","74","","443  >  47030 [ACK] Seq=3672 Ack=769 Win=68608 Len=0"
"231","01:50:25.167381562","2606:4700::6810:f9f9","2601:143:c701:ae60:6758:2126:81b1:b731","TLSv1.3","105","","Application Data"
"232","01:50:25.167400683","2601:143:c701:ae60:6758:2126:81b1:b731","2606:4700::6810:f9f9","TCP","74","","47030  >  443 [RST] Seq=769 Win=0 Len=0"
"233","01:50:25.167518018","2606:4700::6810:f9f9","2601:143:c701:ae60:6758:2126:81b1:b731","TCP","74","","443  >  47026 [ACK] Seq=4045 Ack=1042 Win=69632 Len=0"
"234","01:50:25.168154862","2606:4700::6810:f9f9","2601:143:c701:ae60:6758:2126:81b1:b731","TCP","74","","443  >  47026 [ACK] Seq=4045 Ack=1140 Win=69632 Len=0"
"235","01:50:25.168154889","2606:4700::6810:f9f9","2601:143:c701:ae60:6758:2126:81b1:b731","TCP","74","","443  >  47026 [ACK] Seq=4045 Ack=1293 Win=70656 Len=0"
"236","01:50:25.168282872","2606:4700::6810:f9f9","2601:143:c701:ae60:6758:2126:81b1:b731","TCP","74","","443  >  47026 [ACK] Seq=4045 Ack=1349 Win=70656 Len=0"
"237","01:50:25.168282898","2606:4700::6810:f9f9","2601:143:c701:ae60:6758:2126:81b1:b731","TLSv1.3","497","","Application Data"
"238","01:50:25.168282922","2606:4700::6810:f9f9","2601:143:c701:ae60:6758:2126:81b1:b731","TLSv1.3","105","","Application Data"
"239","01:50:25.168282937","2606:4700::6810:f9f9","2601:143:c701:ae60:6758:2126:81b1:b731","TLSv1.3","343","","Application Data"
"240","01:50:25.168407569","2601:143:c701:ae60:6758:2126:81b1:b731","2606:4700::6810:f9f9","TCP","74","","47026  >  443 [ACK] Seq=1949 Ack=4768 Win=64128 Len=0"
"241","01:50:25.168637253","2606:4700::6810:f9f9","2601:143:c701:ae60:6758:2126:81b1:b731","TCP","74","","443  >  47026 [ACK] Seq=4045 Ack=1442 Win=70656 Len=0"
"242","01:50:25.168637306","2606:4700::6810:f9f9","2601:143:c701:ae60:6758:2126:81b1:b731","TCP","74","","443  >  47026 [ACK] Seq=4045 Ack=1605 Win=71680 Len=0"
"243","01:50:25.168642253","2601:143:c701:ae60:6758:2126:81b1:b731","2606:4700::6810:f9f9","TCP","74","","[TCP Dup ACK 240#1] 47026  >  443 [ACK] Seq=1949 Ack=4768 Win=64128 Len=0"
"244","01:50:25.168745449","2606:4700::6810:f9f9","2601:143:c701:ae60:6758:2126:81b1:b731","TLSv1.3","105","","Application Data"
"245","01:50:25.168753368","2601:143:c701:ae60:6758:2126:81b1:b731","2606:4700::6810:f9f9","TCP","74","","47026  >  443 [ACK] Seq=1949 Ack=4799 Win=64128 Len=0"
"246","01:50:25.169436511","2606:4700::6810:f9f9","2601:143:c701:ae60:6758:2126:81b1:b731","TCP","74","","443  >  47026 [ACK] Seq=4045 Ack=1661 Win=71680 Len=0"
"247","01:50:25.169437222","2606:4700::6810:f9f9","2601:143:c701:ae60:6758:2126:81b1:b731","TLSv1.3","611","","Application Data, Application Data"
"248","01:50:25.169447201","2601:143:c701:ae60:6758:2126:81b1:b731","2606:4700::6810:f9f9","TCP","74","","47034  >  443 [ACK] Seq=769 Ack=3680 Win=63616 Len=0"
"249","01:50:25.169547049","2606:4700::6810:f9f9","2601:143:c701:ae60:6758:2126:81b1:b731","TLSv1.3","276","","Application Data"
"250","01:50:25.169547071","2606:4700::6810:f9f9","2601:143:c701:ae60:6758:2126:81b1:b731","TLSv1.3","105","","Application Data"
"251","01:50:25.169578049","2601:143:c701:ae60:6758:2126:81b1:b731","2606:4700::6810:f9f9","TLSv1.3","98","","Application Data"
"252","01:50:25.169589984","2601:143:c701:ae60:6758:2126:81b1:b731","2606:4700::6810:f9f9","TCP","74","","47034  >  443 [FIN, ACK] Seq=793 Ack=3680 Win=64128 Len=0"
"253","01:50:25.169747459","2601:143:c701:ae60:6758:2126:81b1:b731","2606:4700::6810:f9f9","TCP","74","","47026  >  443 [ACK] Seq=1949 Ack=5032 Win=64128 Len=0"
"254","01:50:25.170758645","2601:143:c701:ae60:6758:2126:81b1:b731","2606:4700::6810:f9f9","TLSv1.3","134","","Application Data"
"255","01:50:25.170774173","2601:143:c701:ae60:6758:2126:81b1:b731","2606:4700::6810:f9f9","TLSv1.3","166","","Application Data"
"256","01:50:25.171465117","2606:4700::6810:f9f9","2601:143:c701:ae60:6758:2126:81b1:b731","TCP","86","","[TCP Dup ACK 230#1] 443  >  47030 [ACK] Seq=3703 Ack=769 Win=68608 Len=0 SLE=793 SRE=794"
"257","01:50:25.171493613","2601:143:c701:ae60:6758:2126:81b1:b731","2606:4700::6810:f9f9","TCP","74","","47030  >  443 [RST] Seq=769 Win=0 Len=0"
"258","01:50:25.171554370","2606:4700::6810:f9f9","2601:143:c701:ae60:6758:2126:81b1:b731","TCP","74","","443  >  47028 [ACK] Seq=3144 Ack=582 Win=67584 Len=0"
"259","01:50:25.171554412","2606:4700::6810:f9f9","2601:143:c701:ae60:6758:2126:81b1:b731","TCP","74","","443  >  47028 [ACK] Seq=3144 Ack=769 Win=68608 Len=0"
"260","01:50:25.172222418","2606:4700::6810:f9f9","2601:143:c701:ae60:6758:2126:81b1:b731","TCP","74","","443  >  47032 [ACK] Seq=3144 Ack=582 Win=67584 Len=0"
"261","01:50:25.172222475","2606:4700::6810:f9f9","2601:143:c701:ae60:6758:2126:81b1:b731","TCP","74","","443  >  47032 [ACK] Seq=3144 Ack=769 Win=68608 Len=0"
"262","01:50:25.172224392","2606:4700::6810:f9f9","2601:143:c701:ae60:6758:2126:81b1:b731","TLSv1.3","611","","Application Data, Application Data"
"263","01:50:25.172234190","2601:143:c701:ae60:6758:2126:81b1:b731","2606:4700::6810:f9f9","TCP","74","","47028  >  443 [ACK] Seq=769 Ack=3681 Win=63616 Len=0"
"264","01:50:25.172344413","2601:143:c701:ae60:6758:2126:81b1:b731","2606:4700::6810:f9f9","TLSv1.3","98","","Application Data"
"265","01:50:25.172352793","2601:143:c701:ae60:6758:2126:81b1:b731","2606:4700::6810:f9f9","TCP","74","","47028  >  443 [FIN, ACK] Seq=793 Ack=3681 Win=64128 Len=0"
"266","01:50:25.173212089","2606:4700::6810:f9f9","2601:143:c701:ae60:6758:2126:81b1:b731","TLSv1.3","611","","Application Data, Application Data"
"267","01:50:25.173218903","2601:143:c701:ae60:6758:2126:81b1:b731","2606:4700::6810:f9f9","TCP","74","","47032  >  443 [ACK] Seq=769 Ack=3681 Win=63616 Len=0"
"268","01:50:25.173314480","2606:4700::6810:f9f9","2601:143:c701:ae60:6758:2126:81b1:b731","TLSv1.3","439","","Application Data"
"269","01:50:25.173314513","2606:4700::6810:f9f9","2601:143:c701:ae60:6758:2126:81b1:b731","TLSv1.3","105","","Application Data"
"270","01:50:25.173386604","2601:143:c701:ae60:6758:2126:81b1:b731","2606:4700::6810:f9f9","TLSv1.3","98","","Application Data"
"271","01:50:25.173394571","2601:143:c701:ae60:6758:2126:81b1:b731","2606:4700::6810:f9f9","TCP","74","","47032  >  443 [FIN, ACK] Seq=793 Ack=3681 Win=64128 Len=0"
"272","01:50:25.173602532","2601:143:c701:ae60:6758:2126:81b1:b731","2606:4700::6810:f9f9","TCP","74","","47026  >  443 [ACK] Seq=2101 Ack=5428 Win=64128 Len=0"
"273","01:50:25.174492421","2601:143:c701:ae60:6758:2126:81b1:b731","2606:4700::6810:f9f9","TLSv1.3","134","","Application Data"
"274","01:50:25.174500532","2601:143:c701:ae60:6758:2126:81b1:b731","2606:4700::6810:f9f9","TLSv1.3","206","","Application Data"
"275","01:50:25.179247941","2606:4700::6810:f9f9","2601:143:c701:ae60:6758:2126:81b1:b731","TCP","74","","443  >  47026 [ACK] Seq=5428 Ack=1949 Win=72704 Len=0"
"276","01:50:25.179247966","2606:4700::6810:f9f9","2601:143:c701:ae60:6758:2126:81b1:b731","TLSv1.3","337","","Application Data"
"277","01:50:25.179247982","2606:4700::6810:f9f9","2601:143:c701:ae60:6758:2126:81b1:b731","TLSv1.3","105","","Application Data"
"278","01:50:25.179349213","2601:143:c701:ae60:6758:2126:81b1:b731","2606:4700::6810:f9f9","TCP","74","","47026  >  443 [ACK] Seq=2293 Ack=5722 Win=64128 Len=0"
"279","01:50:25.181590117","2606:4700::6810:f9f9","2601:143:c701:ae60:6758:2126:81b1:b731","TLSv1.3","359","","Application Data"
"280","01:50:25.181590136","2606:4700::6810:f9f9","2601:143:c701:ae60:6758:2126:81b1:b731","TLSv1.3","105","","Application Data"
"281","01:50:25.181672708","2601:143:c701:ae60:6758:2126:81b1:b731","2606:4700::6810:f9f9","TCP","74","","47026  >  443 [ACK] Seq=2293 Ack=6038 Win=64128 Len=0"
"282","01:50:25.181699644","2606:4700::6810:f9f9","2601:143:c701:ae60:6758:2126:81b1:b731","TCP","74","","443  >  47030 [ACK] Seq=3703 Ack=794 Win=68608 Len=0"
"283","01:50:25.181711696","2601:143:c701:ae60:6758:2126:81b1:b731","2606:4700::6810:f9f9","TCP","74","","47030  >  443 [RST] Seq=794 Win=0 Len=0"
"284","01:50:25.182410426","2606:4700::6810:f9f9","2601:143:c701:ae60:6758:2126:81b1:b731","TCP","74","","443  >  47030 [FIN, ACK] Seq=3703 Ack=794 Win=68608 Len=0"
"285","01:50:25.182415180","2601:143:c701:ae60:6758:2126:81b1:b731","2606:4700::6810:f9f9","TCP","74","","47030  >  443 [RST] Seq=794 Win=0 Len=0"
"286","01:50:25.186247442","2606:4700::6810:f9f9","2601:143:c701:ae60:6758:2126:81b1:b731","TCP","74","","443  >  47026 [ACK] Seq=6038 Ack=2101 Win=72704 Len=0"
